{"$ref":"#/definitions/decision-guides","definitions":{"decision-guides":{"type":"object","properties":{"id":{"type":"string"},"title":{"type":"string"},"description":{"type":"string"},"category":{"type":"string","enum":["database","architecture","cloud","frontend","backend","devops","testing"]},"icon":{"type":"string"},"questions":{"type":"array","items":{"type":"object","properties":{"id":{"type":"string"},"question":{"type":"string"},"options":{"type":"array","items":{"type":"object","properties":{"label":{"type":"string"},"value":{"type":"string"},"leadsTo":{"type":"string"}},"required":["label","value"],"additionalProperties":false}}},"required":["id","question","options"],"additionalProperties":false}},"recommendations":{"type":"array","items":{"type":"object","properties":{"id":{"type":"string"},"technology":{"type":"string"},"description":{"type":"string"},"pros":{"type":"array","items":{"type":"string"}},"cons":{"type":"array","items":{"type":"string"}},"bestFor":{"type":"array","items":{"type":"string"}},"resources":{"type":"array","items":{"type":"object","properties":{"title":{"type":"string"},"url":{"type":"string","format":"uri"},"type":{"type":"string","enum":["docs","tutorial","video","course"]}},"required":["title","url","type"],"additionalProperties":false}}},"required":["id","technology","description","pros","cons","bestFor"],"additionalProperties":false}},"$schema":{"type":"string"}},"required":["id","title","description","category","icon","questions","recommendations"],"additionalProperties":false}},"$schema":"http://json-schema.org/draft-07/schema#"}