{
    "id": "architecture-selection",
    "title": "¿Monolito, Microservicios o Serverless?",
    "description": "Guía interactiva basada en Martin Fowler, AWS Well-Architected y Google Cloud Architecture para elegir la arquitectura correcta.",
    "category": "architecture",
    "icon": "fas fa-sitemap",
    "questions": [
        {
            "id": "q1-team-size",
            "question": "¿Cuál es el tamaño de tu equipo de desarrollo?",
            "options": [
                {
                    "label": "1-5 desarrolladores (equipo pequeño)",
                    "value": "small",
                    "leadsTo": "q2-small-complexity"
                },
                {
                    "label": "6-20 desarrolladores (equipo mediano)",
                    "value": "medium",
                    "leadsTo": "q2-medium-growth"
                },
                {
                    "label": "20+ desarrolladores (múltiples equipos)",
                    "value": "large",
                    "leadsTo": "q3-domain-complexity"
                }
            ]
        },
        {
            "id": "q2-small-complexity",
            "question": "¿Cuál es la complejidad del dominio de negocio?",
            "options": [
                {
                    "label": "Simple: CRUD básico, pocas reglas de negocio",
                    "value": "simple",
                    "leadsTo": "rec-modular-monolith"
                },
                {
                    "label": "Moderada: Reglas de negocio, integraciones",
                    "value": "moderate",
                    "leadsTo": "rec-modular-monolith"
                },
                {
                    "label": "Event-driven: Muchos eventos asíncronos",
                    "value": "event-driven",
                    "leadsTo": "rec-serverless"
                }
            ]
        },
        {
            "id": "q2-medium-growth",
            "question": "¿Cuál es la expectativa de crecimiento?",
            "options": [
                {
                    "label": "Estable: Crecimiento predecible y gradual",
                    "value": "stable",
                    "leadsTo": "rec-modular-monolith"
                },
                {
                    "label": "Alto crecimiento: Escalar rápidamente",
                    "value": "high-growth",
                    "leadsTo": "q3-domain-complexity"
                },
                {
                    "label": "Variable: Picos de tráfico impredecibles",
                    "value": "variable",
                    "leadsTo": "rec-serverless"
                }
            ]
        },
        {
            "id": "q3-domain-complexity",
            "question": "¿Cómo se organizan los dominios de negocio?",
            "options": [
                {
                    "label": "Dominios claramente separados (ventas, inventario, pagos)",
                    "value": "clear-domains",
                    "leadsTo": "rec-microservices"
                },
                {
                    "label": "Dominios muy interconectados",
                    "value": "interconnected",
                    "leadsTo": "rec-modular-monolith"
                },
                {
                    "label": "Mix: algunos independientes, otros relacionados",
                    "value": "mixed",
                    "leadsTo": "q4-deployment"
                }
            ]
        },
        {
            "id": "q4-deployment",
            "question": "¿Cómo quieres desplegar?",
            "options": [
                {
                    "label": "Deploy independiente por dominio",
                    "value": "independent",
                    "leadsTo": "rec-microservices"
                },
                {
                    "label": "Deploy único, más simple",
                    "value": "single",
                    "leadsTo": "rec-modular-monolith"
                },
                {
                    "label": "Sin servidores, pago por uso",
                    "value": "serverless",
                    "leadsTo": "rec-serverless"
                }
            ]
        }
    ],
    "recommendations": [
        {
            "id": "rec-modular-monolith",
            "technology": "Modular Monolith",
            "description": "Arquitectura monolítica bien estructurada con módulos internos desacoplados. Recomendada por Martin Fowler como punto de partida.",
            "pros": [
                "Simplicidad operacional (un deploy)",
                "Transacciones ACID fáciles",
                "Debugging más simple (un proceso)",
                "Menor latencia (sin network hops)",
                "Fácil de refactorizar a microservicios después"
            ],
            "cons": [
                "Escalabilidad: todo escala junto",
                "Un bug puede afectar todo el sistema",
                "Deployment monolítico (todo o nada)",
                "Tech stack único"
            ],
            "bestFor": [
                "Startups y MVPs",
                "Equipos pequeños (1-10 devs)",
                "Dominios no completamente definidos",
                "Cuando el time-to-market es crítico"
            ],
            "resources": [
                {
                    "title": "Martin Fowler - Monolith First",
                    "url": "https://martinfowler.com/bliki/MonolithFirst.html",
                    "type": "docs"
                },
                {
                    "title": "Modular Monolith Architecture",
                    "url": "https://www.kamilgrzybek.com/design/modular-monolith-primer/",
                    "type": "tutorial"
                }
            ]
        },
        {
            "id": "rec-microservices",
            "technology": "Microservicios",
            "description": "Arquitectura distribuida donde cada servicio es independiente, desplegable por separado y con su propia base de datos.",
            "pros": [
                "Escalabilidad independiente por servicio",
                "Deploy independiente (CI/CD por equipo)",
                "Autonomía de equipos (Conway's Law)",
                "Resiliencia: fallo aislado",
                "Flexibilidad tecnológica (polyglot)"
            ],
            "cons": [
                "Complejidad operacional alta",
                "Consistencia eventual (saga patterns)",
                "Latencia por network hops",
                "Observabilidad compleja",
                "Requiere DevOps maduro"
            ],
            "bestFor": [
                "Equipos grandes (20+ devs)",
                "Dominios de negocio bien definidos",
                "Requisitos de escala diferentes por dominio",
                "Organizaciones con DevOps maduro"
            ],
            "resources": [
                {
                    "title": "Microservices Patterns - Chris Richardson",
                    "url": "https://microservices.io/patterns/",
                    "type": "docs"
                },
                {
                    "title": "AWS Microservices",
                    "url": "https://aws.amazon.com/microservices/",
                    "type": "docs"
                }
            ]
        },
        {
            "id": "rec-serverless",
            "technology": "Serverless / FaaS",
            "description": "Arquitectura donde el proveedor cloud maneja servidores. Pagas por ejecución, no por tiempo activo.",
            "pros": [
                "Sin gestión de servidores",
                "Escalado automático a cero",
                "Pago por uso (cost-efficient para cargas variables)",
                "Time-to-market rápido",
                "Alta disponibilidad built-in"
            ],
            "cons": [
                "Cold starts (latencia inicial)",
                "Límites de ejecución (timeout)",
                "Vendor lock-in",
                "Debugging más complejo",
                "Stateless por naturaleza"
            ],
            "bestFor": [
                "APIs y webhooks",
                "Procesamiento de eventos",
                "Cron jobs y tareas programadas",
                "Cargas de trabajo variables",
                "Procesamiento de archivos (S3 triggers)"
            ],
            "resources": [
                {
                    "title": "AWS Lambda Documentation",
                    "url": "https://docs.aws.amazon.com/lambda/",
                    "type": "docs"
                },
                {
                    "title": "Serverless Framework",
                    "url": "https://www.serverless.com/framework/docs",
                    "type": "docs"
                }
            ]
        }
    ]
}
